{
  "schemaVersion": 1,
  "fixtureId": "direct-lyrics-short",
  "contractSha256": "69b12dd7ba0216c3f4bbff2ce1b35056fe81d3c24e086e73df65ed78dd81304e",
  "contract": {
    "coverage": [
      "direct",
      "supplied-lyrics",
      "short-conditioning",
      "short-duration",
      "dcw-default"
    ],
    "source": {
      "aceRepositoryCommit": "6d467e4b5081ccb0abf1ec1bf4fdf9051a2d34b0",
      "mainModelId": "ACE-Step/Ace-Step1.5",
      "mainModelRevision": "19671f406d603126926c1b7e2adc169acbcade22",
      "mainModelVariant": "acestep-v15-turbo",
      "plannerModelId": "ACE-Step/acestep-5Hz-lm-0.6B",
      "plannerModelRevision": "148d8ea0225bdab342ee1ae3a354275ccd60ca80"
    },
    "request": {
      "batchSize": 1,
      "taskType": "text2music",
      "resolvedTaskType": "text2music",
      "instruction": "Fill the audio semantic mask based on the given conditions:",
      "caption": "Intimate indie pop with a clear alto lead vocal, muted guitar, dry drums, melodic bass, and a gently widening chorus.",
      "lyrics": "[Verse]\nStreetlights draw a line across the rain\nI count the quiet windows on the train\n\n[Chorus]\nCarry the morning into view\nI kept a little light for you",
      "instrumental": false,
      "vocalLanguage": "en",
      "bpm": 96,
      "keyScale": "A major",
      "timeSignature": "4",
      "durationSeconds": 16,
      "referenceAudio": null,
      "sourceAudio": null,
      "audioCodes": "",
      "audioCoverStrength": 1.0,
      "coverNoiseStrength": 0.0,
      "chunkMaskMode": "auto",
      "repaintingStart": 0.0,
      "repaintingEnd": null,
      "retakeVariance": 0.0,
      "retakeSeed": null
    },
    "planner": {
      "enabled": false,
      "thinking": false,
      "useCotMetas": false,
      "useCotCaption": false,
      "useCotLyrics": false,
      "useCotLanguage": false,
      "useConstrainedDecoding": true,
      "temperature": 0.85,
      "cfgScale": 2.0,
      "topK": 0,
      "topP": 0.9,
      "repetitionPenalty": 1.0,
      "negativePrompt": "NO USER INPUT"
    },
    "diffusion": {
      "inferenceSteps": 8,
      "shift": 3.0,
      "customTimesteps": null,
      "resolvedTimesteps": [
        1.0,
        0.9545454545454546,
        0.9,
        0.8333333333333334,
        0.75,
        0.6428571428571429,
        0.5,
        0.3
      ],
      "effectiveTimestepsBfloat16": [
        1.0,
        0.953125,
        0.8984375,
        0.83203125,
        0.75,
        0.64453125,
        0.5,
        0.30078125
      ],
      "inferMethod": "ode",
      "samplerMode": "euler",
      "guidanceScale": 1.0,
      "useAdg": false,
      "cfgIntervalStart": 0.0,
      "cfgIntervalEnd": 1.0,
      "velocityNormThreshold": 0.0,
      "velocityEmaFactor": 0.0,
      "dcw": {
        "enabled": true,
        "mode": "double",
        "lowScaler": 0.05,
        "highScaler": 0.02,
        "wavelet": "haar",
        "levels": 1,
        "boundaryMode": "zero",
        "computeDtype": "float32"
      },
      "latentShift": 0.0,
      "latentRescale": 1.0
    },
    "postprocess": {
      "vaeDtype": "float32",
      "sampleRate": 48000,
      "channels": 2,
      "normalize": true,
      "normalizationDb": -1.0,
      "fadeInSeconds": 0.0,
      "fadeOutSeconds": 0.0,
      "captureRawBeforeNormalization": true
    },
    "random": {
      "userSeed": "00000000a205b064",
      "useRandomSeed": false,
      "algorithmId": "ace-seed-v1",
      "generator": "philox4x32-10",
      "diffusionStream": "diffusion-noise",
      "plannerStream": "planner-sampling",
      "gaussianMapping": "probit-acklam-binary64-f32-v1",
      "categoricalMapping": "u32-midpoint-binary64-cdf-v1",
      "initialNoise": {
        "tapId": "diffusion.initial-noise",
        "dtype": "float32",
        "shape": [
          1,
          400,
          64
        ],
        "layout": "row-major-little-endian",
        "sha256": "2a4acd57ee71340608b8cf5943db60ffa8bfe138c5b62f597a8cf5af0d6767be"
      },
      "referenceInitialNoiseInjectionRequired": true,
      "randomTransformCaptureStatus": "ready-for-native-capture"
    },
    "expected": {
      "latentFrames": 400,
      "patchedTokens": 200,
      "semanticCodes": 0,
      "audioSamplesPerChannel": 768000
    }
  }
}
