{
  "schemaVersion": 1,
  "fixtureId": "direct-lyrics-long-condition",
  "contractSha256": "c9c6c50aba153ebbcc520f2518974857eb3b3eedf48b5c6a9003b4a22e1726c3",
  "contract": {
    "coverage": [
      "direct",
      "supplied-lyrics",
      "long-conditioning",
      "short-duration",
      "dcw-default"
    ],
    "source": {
      "aceRepositoryCommit": "6d467e4b5081ccb0abf1ec1bf4fdf9051a2d34b0",
      "mainModelId": "ACE-Step/Ace-Step1.5",
      "mainModelRevision": "19671f406d603126926c1b7e2adc169acbcade22",
      "mainModelVariant": "acestep-v15-turbo",
      "plannerModelId": "ACE-Step/acestep-5Hz-lm-0.6B",
      "plannerModelRevision": "148d8ea0225bdab342ee1ae3a354275ccd60ca80"
    },
    "request": {
      "batchSize": 1,
      "taskType": "text2music",
      "resolvedTaskType": "text2music",
      "instruction": "Fill the audio semantic mask based on the given conditions:",
      "caption": "Cinematic progressive soul suite: close-miked expressive lead vocal, stacked call-and-response harmonies, felt piano, syncopated drums, bowed strings, brass swells, granular ambience, recurring four-note motif, dynamic but unclipped master, precise stereo placement, verses restrained and conversational, pre-choruses steadily rising, choruses broad and luminous, bridge sparse before a final full-band return.",
      "lyrics": "[Verse 1]\nThe map was folded underneath the cup\nBlue ink rivers where the roads gave up\nWe wrote the names of towns we never knew\nAnd left one empty line to lead us through\nThe station clock was leaning into dawn\nThe platform hummed after everyone had gone\nI heard the rails repeat a four-note phrase\nA small machine remembering our days\n\n[Pre-Chorus]\nIf every mile is borrowed time\nLet every signal turn in time\n\n[Chorus]\nHold the horizon, hold it steady\nCarry the color when the sky is heavy\nCall through the distance, clear and true\nI will leave the porch light on for you\n\n[Verse 2]\nThe orchard kept the weather in its leaves\nThe radio spoke softly through the eaves\nA kettle traced a circle in the air\nAs if the room still knew that you were there\nI fixed the latch and swept the hallway clean\nFound summer dust behind the washing machine\nThe ordinary things refused to fade\nThey kept the shape of every choice we made\n\n[Pre-Chorus]\nIf every mile is borrowed time\nLet every signal turn in time\n\n[Chorus]\nHold the horizon, hold it steady\nCarry the color when the sky is heavy\nCall through the distance, clear and true\nI will leave the porch light on for you\n\n[Bridge]\nNo grand arrival, no parade\nOnly the sound the screen door made\nOne quiet footstep, then another\nRain on the roof and light on water\nWe do not need to name the weather\nWe only need to stand together\n\n[Final Chorus]\nHold the horizon, hold it steady\nCarry the color, I am ready\nCall through the distance, clear and true\nEvery road has led me back to you\nHold the horizon through the blue\nI kept the final open line for you\n\n[Outro]\nFour notes fading down the track\nOne light saying you can come back",
      "instrumental": false,
      "vocalLanguage": "en",
      "bpm": 82,
      "keyScale": "F# minor",
      "timeSignature": "4",
      "durationSeconds": 20,
      "referenceAudio": null,
      "sourceAudio": null,
      "audioCodes": "",
      "audioCoverStrength": 1.0,
      "coverNoiseStrength": 0.0,
      "chunkMaskMode": "auto",
      "repaintingStart": 0.0,
      "repaintingEnd": null,
      "retakeVariance": 0.0,
      "retakeSeed": null
    },
    "planner": {
      "enabled": false,
      "thinking": false,
      "useCotMetas": false,
      "useCotCaption": false,
      "useCotLyrics": false,
      "useCotLanguage": false,
      "useConstrainedDecoding": true,
      "temperature": 0.85,
      "cfgScale": 2.0,
      "topK": 0,
      "topP": 0.9,
      "repetitionPenalty": 1.0,
      "negativePrompt": "NO USER INPUT"
    },
    "diffusion": {
      "inferenceSteps": 8,
      "shift": 3.0,
      "customTimesteps": null,
      "resolvedTimesteps": [
        1.0,
        0.9545454545454546,
        0.9,
        0.8333333333333334,
        0.75,
        0.6428571428571429,
        0.5,
        0.3
      ],
      "effectiveTimestepsBfloat16": [
        1.0,
        0.953125,
        0.8984375,
        0.83203125,
        0.75,
        0.64453125,
        0.5,
        0.30078125
      ],
      "inferMethod": "ode",
      "samplerMode": "euler",
      "guidanceScale": 1.0,
      "useAdg": false,
      "cfgIntervalStart": 0.0,
      "cfgIntervalEnd": 1.0,
      "velocityNormThreshold": 0.0,
      "velocityEmaFactor": 0.0,
      "dcw": {
        "enabled": true,
        "mode": "double",
        "lowScaler": 0.05,
        "highScaler": 0.02,
        "wavelet": "haar",
        "levels": 1,
        "boundaryMode": "zero",
        "computeDtype": "float32"
      },
      "latentShift": 0.0,
      "latentRescale": 1.0
    },
    "postprocess": {
      "vaeDtype": "float32",
      "sampleRate": 48000,
      "channels": 2,
      "normalize": true,
      "normalizationDb": -1.0,
      "fadeInSeconds": 0.0,
      "fadeOutSeconds": 0.0,
      "captureRawBeforeNormalization": true
    },
    "random": {
      "userSeed": "00000000deadbeef",
      "useRandomSeed": false,
      "algorithmId": "ace-seed-v1",
      "generator": "philox4x32-10",
      "diffusionStream": "diffusion-noise",
      "plannerStream": "planner-sampling",
      "gaussianMapping": "probit-acklam-binary64-f32-v1",
      "categoricalMapping": "u32-midpoint-binary64-cdf-v1",
      "initialNoise": {
        "tapId": "diffusion.initial-noise",
        "dtype": "float32",
        "shape": [
          1,
          500,
          64
        ],
        "layout": "row-major-little-endian",
        "sha256": "3e6e13598e8849f66702a80e8d89e0710497f74850d18371a6b0e5bb448af532"
      },
      "referenceInitialNoiseInjectionRequired": true,
      "randomTransformCaptureStatus": "ready-for-native-capture"
    },
    "expected": {
      "latentFrames": 500,
      "patchedTokens": 250,
      "semanticCodes": 0,
      "audioSamplesPerChannel": 960000
    }
  }
}
